{
  "contract": "lekishi-historical-contract/v0",
  "document": "record",
  "kind": "place",
  "record_id": "lks:place:example-harbour",
  "created_at": "2026-01-02T00:00:00Z",
  "revisions": [
    {
      "revision_id": "lks:rev:example-harbour-1",
      "created_at": "2026-01-02T00:00:00Z",
      "author": {"name": "Contract example"},
      "change_explanation": "Initial synthetic example of a disputed location with an attributed alternative.",
      "content": {
        "summary": "Synthetic contract example of a disputed placement: one attributed main account with a cited alternative. Not historical content.",
        "names": [
          {
            "form": "Example Harbour",
            "script": "Latn",
            "language": "en",
            "role": "primary",
            "claim_id": "lks:claim:example-harbour-name"
          }
        ],
        "place_types": ["port"],
        "geometry": [
          {
            "claim_id": "lks:claim:example-harbour-location-main",
            "interpretation": "approximate_point",
            "geojson": {"type": "Point", "coordinates": [121.5, 31.2]},
            "precision": "locality",
            "notes": "synthetic example: main account places the harbour at this locality"
          },
          {
            "claim_id": "lks:claim:example-harbour-location-alternative",
            "interpretation": "source_supported_area",
            "geojson": {
              "type": "Polygon",
              "coordinates": [[[121.2, 31.0], [121.9, 31.0], [121.9, 31.5], [121.2, 31.0]]]
            },
            "precision": "region",
            "notes": "synthetic example: the cited study depicts a wider estuarine extent, not a uniform-probability area"
          }
        ],
        "editorial_notes": "Synthetic contract example demonstrating the main-account and cited-alternatives policy. Not historical content."
      },
      "claims": [
        {
          "claim_id": "lks:claim:example-harbour-name",
          "statement": "The source names the harbour.",
          "asserts": "/names/0",
          "basis": "attested",
          "role": "main",
          "citations": [{"source_id": "lks:source:example-chronicle-a", "locator": {"kind": "page", "value": "30"}}]
        },
        {
          "claim_id": "lks:claim:example-harbour-location-main",
          "statement": "The chronicle places the harbour at this locality.",
          "asserts": "/geometry/0",
          "basis": "attested",
          "role": "main",
          "citations": [{"source_id": "lks:source:example-chronicle-a", "locator": {"kind": "page", "value": "30"}}]
        },
        {
          "claim_id": "lks:claim:example-harbour-location-alternative",
          "statement": "The cited study places the harbour across a wider estuarine extent.",
          "asserts": "/geometry/1",
          "basis": "cited_interpretation",
          "role": "conflicting",
          "attributed_to": "Example Study B (synthetic)",
          "citations": [{"source_id": "lks:source:example-study-b", "locator": {"kind": "map", "value": "figure 4"}}]
        }
      ],
      "dispute": {
        "status": "disputed",
        "summary": "The chronicle and the cited study disagree on how precisely the harbour can be placed."
      },
      "revision_hash": "sha256:d5cfea2f9f1405e878e0c49b7dd0d117129b40bc9c60de5ec53437fd0e8fca54"
    }
  ],
  "publication": {
    "published_revision_id": "lks:rev:example-harbour-1",
    "published_revision_hash": "sha256:d5cfea2f9f1405e878e0c49b7dd0d117129b40bc9c60de5ec53437fd0e8fca54",
    "set_id": "lks:set:example-contract-v1",
    "published_at": "2026-01-06T00:00:00Z",
    "published_by": {"name": "Contract example"}
  }
}
