{
  "contract": "lekishi-historical-contract/v0",
  "document": "record",
  "kind": "relationship",
  "record_id": "lks:relationship:example-influence",
  "created_at": "2026-01-02T00:00:00Z",
  "revisions": [
    {
      "revision_id": "lks:rev:example-influence-1",
      "created_at": "2026-01-02T00:00:00Z",
      "author": {"name": "Contract example"},
      "change_explanation": "Initial synthetic example separating an attested journey from a cited interpretation of later influence.",
      "content": {
        "summary": "Synthetic contract example of a proposed influence presented as a cited scholarly interpretation. Not historical content.",
        "relationship_types": ["proposed_influence"],
        "from": "lks:event:example-departure",
        "to": "lks:actor:example-institution",
        "directionality": "directed",
        "causality": "asserted",
        "editorial_notes": "Synthetic contract example: documented contact does not establish influence, so this relationship rests on a cited interpretation with its advocate named."
      },
      "claims": [
        {
          "claim_id": "lks:claim:example-influence",
          "statement": "The cited study proposes that the journey contributed to the institution's later role.",
          "asserts": "",
          "basis": "cited_interpretation",
          "role": "main",
          "attributed_to": "Example Study B (synthetic)",
          "citations": [{"source_id": "lks:source:example-study-b", "locator": {"kind": "page", "value": "88"}}]
        }
      ],
      "revision_hash": "sha256:45dbb58e86b54cc7a5ba72aadca08638264a50d87dfc611f5750ec7f961381c9"
    }
  ],
  "publication": {
    "published_revision_id": "lks:rev:example-influence-1",
    "published_revision_hash": "sha256:45dbb58e86b54cc7a5ba72aadca08638264a50d87dfc611f5750ec7f961381c9",
    "set_id": "lks:set:example-contract-v1",
    "published_at": "2026-01-06T00:00:00Z",
    "published_by": {"name": "Contract example"}
  }
}
