{
  "contract": "lekishi-historical-contract/v0",
  "document": "record",
  "kind": "event",
  "record_id": "lks:event:example-departure",
  "created_at": "2026-01-02T00:00:00Z",
  "revisions": [
    {
      "revision_id": "lks:rev:example-departure-1",
      "created_at": "2026-01-02T00:00:00Z",
      "author": {"name": "Contract example"},
      "change_explanation": "Initial synthetic example of a multi-year journey and the contrast with an uncertain occurrence.",
      "content": {
        "summary": "Synthetic contract example of a journey supported across two years. Not historical content.",
        "event_types": ["journey"],
        "time": {
          "source_expression": "761 to 762 CE",
          "calendar": "julian",
          "precision": "year",
          "mode": "duration",
          "interval": {
            "bounds": "two_sided",
            "boundary": "inclusive",
            "start": {"year": 761, "era": "ce", "endpoint_certainty": "exact"},
            "end": {"year": 762, "era": "ce", "endpoint_certainty": "approximate"}
          }
        },
        "places": [
          {"place_id": "lks:place:example-changan", "role": "start"},
          {"place_id": "lks:place:example-harbour", "role": "end"}
        ],
        "participants": [{"actor_id": "lks:actor:example-envoy", "role": "leader"}],
        "editorial_notes": "Synthetic contract example: a duration supports continuous activity, unlike an occurrence window of the same length."
      },
      "claims": [
        {
          "claim_id": "lks:claim:example-departure-time",
          "statement": "The source reports a journey across these years.",
          "asserts": "/time",
          "basis": "attested",
          "role": "main",
          "citations": [{"source_id": "lks:source:example-chronicle-a", "locator": {"kind": "page", "value": "48"}}]
        }
      ],
      "revision_hash": "sha256:caa5a0712bc85ff63212f1d1bb6ae56bb3c07ab8f8dd386cebd2114e8f9b23d4"
    }
  ],
  "publication": {
    "published_revision_id": "lks:rev:example-departure-1",
    "published_revision_hash": "sha256:caa5a0712bc85ff63212f1d1bb6ae56bb3c07ab8f8dd386cebd2114e8f9b23d4",
    "set_id": "lks:set:example-contract-v1",
    "published_at": "2026-01-06T00:00:00Z",
    "published_by": {"name": "Contract example"}
  }
}
